{
  "schema_version": 1,
  "record_type": "DECISION",
  "record_id": "dce50c5b0a2c42ea578ec412f7a6a648fc4572b7809dcb2caf21a55b366e0692",
  "recorded_at": "2026-09-23T09:16:00Z",
  "manifest_id": "fdcc1c5b32bd008d976c20671af67384bc0d595cc4b0f8f84691ee9b0d412ff3",
  "brief_hash": "bf1a2c3d4e5f6a7b8c9d0e1f2a3b4c5d6e7f8a9b0c1d2e3f4a5b6c7d8e9f0a1b",
  "symbol": "XAUUSD",
  "strategy_version": "0.1.0",
  "bar_index": 4,
  "bar_open_at": "2026-09-23T09:00:00Z",
  "decision_at": "2026-09-23T09:15:00Z",
  "action": "CANDIDATE",
  "side": "BUY",
  "reason_code": "RULES_PASSED",
  "proposed_entry": 100.0,
  "stop_loss": 98.0,
  "target_1": 104.0,
  "target_2": 106.0,
  "analyst_confidence": 0.6,
  "probability": null,
  "forecast_event": "T1_BEFORE_STOP_WITHIN_H_AFTER_FIRST_ELIGIBLE_FILL",
  "horizon_bars": 8,
  "expires_at": "2026-09-23T12:00:00Z"
}
