{
  "schema_version": 1,
  "record_type": "DECISION",
  "record_id": "c428b5cf97a905815e32a388c57417223d4eda33a019f999cd8f6848a742281c",
  "recorded_at": "2026-09-23T09:31:00Z",
  "manifest_id": "fdcc1c5b32bd008d976c20671af67384bc0d595cc4b0f8f84691ee9b0d412ff3",
  "brief_hash": null,
  "symbol": "XAUUSD",
  "strategy_version": "0.1.0",
  "bar_index": 5,
  "bar_open_at": "2026-09-23T09:15:00Z",
  "decision_at": "2026-09-23T09:30:00Z",
  "action": "WAIT",
  "side": null,
  "reason_code": "NO_BRIEF",
  "proposed_entry": null,
  "stop_loss": null,
  "target_1": null,
  "target_2": null,
  "analyst_confidence": null,
  "probability": null,
  "forecast_event": null,
  "horizon_bars": null,
  "expires_at": null
}
